{
  "schema_version": "overpatch/v1",
  "status": "success",
  "reason": "",
  "operations": [
    {
      "id": "op_replace_001",
      "action": "replace_text",
      "path": "README.md",
      "find": "old",
      "replace": "new",
      "occurrence": "all",
      "expected_occurrences": 1
    }
  ]
}
